rating,review,summary,actions,timestamp
3,Extremely positive review referencing authenticity and high quality compared to Louisiana food.,General feedback summary.,Needs internal review.,1765047014.4504564
1,Extremely positive review referencing authenticity and high quality compared to Louisiana food.,General feedback summary.,Needs internal review.,1765047186.518142
4,The reviewer uses positive language like 'good',General feedback summary.,Needs internal review.,2025-12-07 00:29:00
2,"he reviewer uses positive language like 'good', 'filling', and 'hits the spot",General feedback summary.,Needs internal review.,2025-12-06 19:11:27 UTC
3,"The review expresses a positive sentiment. Keywords like \""good,\"" \""filling,\"" and \""hits the spot",,,2025-12-07 07:36:38 UTC
5,Understand business problems and convert them into actionable technical requirements.,,,2025-12-07 07:38:25 UTC
